[
  {
    "issue_id": "ISS-0001",
    "title": "品牌知名度不足成为下单阻碍",
    "category": "sales_service",
    "series": [
      "LS6",
      "L6"
    ],
    "affected_function": "品牌认知 / 购车信任",
    "description": "一线反馈门店客流与到店用户对智己品牌了解程度偏低；整车配置不弱于竞品，但用户宁愿选择价格更高、配置略低、知名度更高的竞品，品牌认知成为下单前的信任门槛。",
    "evidence_ids": [
      "EV-0014",
      "EV-0016"
    ],
    "evidence_count": 2,
    "store_count": 1,
    "stores": [
      "贵阳·智己汽车贵阳悦然时光体验中心"
    ],
    "severity": "high",
    "severity_rationale": "多店明确表述品牌知名度直接影响用户下单并导致竞品分流；虽无单店高频量级，但属于决策前置门槛。",
    "business_signal": "purchase_blocker",
    "status": "confirmed",
    "first_seen_date": "2026-09-12",
    "last_seen_date": "2026-09-12",
    "review": {
      "reviewed_by": "opencode-agent",
      "reviewed_at": "2026-09-12",
      "decision": "confirmed",
      "notes": "3 条证据、2 家门店、2 天；证据方向一致（认知→分流→下单），保留 high。"
    },
    "pattern_ids": [
      "PAT-0001"
    ],
    "created_at": "2026-09-12"
  },
  {
    "issue_id": "ISS-0002",
    "title": "智驾（momenta）认知与信任不足",
    "category": "adas",
    "series": [
      "LS6"
    ],
    "affected_function": "智驾 / 供应商认知",
    "description": "现场知道 momenta（MMT）的用户很少、智驾感知不强，认同感远不如华为；重庆因华为为当地企业，用户提问高度集中于智驾。",
    "evidence_ids": [
      "EV-0020",
      "EV-0022"
    ],
    "evidence_count": 2,
    "store_count": 2,
    "stores": [
      "贵阳·贵阳万象汇",
      "重庆·重庆金菱车世界车城店"
    ],
    "severity": "high",
    "severity_rationale": "跨 3 店复现、并与强竞品认知直接对比；智驾是用户主动提问高发主题，认知落差影响价值感知。",
    "business_signal": "competitive_gap",
    "status": "confirmed",
    "first_seen_date": "2026-09-12",
    "last_seen_date": "2026-09-12",
    "review": {
      "reviewed_by": "opencode-agent",
      "reviewed_at": "2026-09-12",
      "decision": "confirmed",
      "notes": "3 条证据跨 3 店 2 天，语义一致（智驾供应商认知低），保留 high。"
    },
    "pattern_ids": [
      "PAT-0002"
    ],
    "created_at": "2026-09-12"
  },
  {
    "issue_id": "ISS-0004",
    "title": "内外饰质感与第一印象不足",
    "category": "interior",
    "series": [
      "LS6",
      "L6",
      "LS8",
      "LS9"
    ],
    "affected_function": "内外饰 / 车漆质感",
    "description": "一线反馈内外饰是客户第一印象、需做到有质感且吸睛；LS8/LS9 车漆漆面被指不高级；且用户对 LS6 内饰外观呈明显两极偏好。",
    "evidence_ids": [
      "EV-0010",
      "EV-0015"
    ],
    "evidence_count": 2,
    "store_count": 2,
    "stores": [
      "贵阳·智己汽车贵阳悦然时光体验中心",
      "重庆·南岸交付中心"
    ],
    "severity": "medium",
    "severity_rationale": "跨 3 店复现，涉及影响首次印象与偏好分化，但未直接表述拒购。",
    "business_signal": "complaint",
    "status": "confirmed",
    "first_seen_date": "2026-09-12",
    "last_seen_date": "2026-09-12",
    "review": {
      "reviewed_by": "opencode-agent",
      "reviewed_at": "2026-09-12",
      "decision": "confirmed",
      "notes": "3 条证据跨 3 店；含 LS8/LS9 车漆与 LS6 内外饰偏好，语义归并为内饰质感维度。"
    },
    "pattern_ids": [
      "PAT-0004"
    ],
    "created_at": "2026-09-12"
  },
  {
    "issue_id": "ISS-0005",
    "title": "价格与权益预期不稳导致观望",
    "category": "sales_service",
    "series": [
      "LS6",
      "L6"
    ],
    "affected_function": "价格 / 权益政策",
    "description": "用户对价格持观望；上市后权益政策不稳定，老客户觉得盲订不实惠，新客户受网络口碑影响而犹豫；也有用户因预算限制改选其他品牌。",
    "evidence_ids": [
      "EV-0012",
      "EV-0024",
      "EV-0026"
    ],
    "evidence_count": 3,
    "store_count": 3,
    "stores": [
      "重庆·重庆时代龙湖天街",
      "重庆·重庆礼嘉天街e",
      "重庆·重庆金菱车世界车城店"
    ],
    "severity": "high",
    "severity_rationale": "跨 3 店复现，明确指向犹豫观望与竞品流失，属决策核心阻碍。",
    "business_signal": "purchase_blocker",
    "status": "confirmed",
    "first_seen_date": "2026-09-12",
    "last_seen_date": "2026-09-12",
    "review": {
      "reviewed_by": "opencode-agent",
      "reviewed_at": "2026-09-12",
      "decision": "confirmed",
      "notes": "3 条证据同一日、3 店；价格/权益方向一致，含 1 例竞品流失，保留 high。"
    },
    "pattern_ids": [
      "PAT-0005"
    ],
    "created_at": "2026-09-12"
  },
  {
    "issue_id": "ISS-0006",
    "title": "车型定位与人群区隔不清",
    "category": "other",
    "series": [
      "LS6",
      "L6",
      "LS8",
      "LS9"
    ],
    "affected_function": "车型定位 / 目标人群",
    "description": "LS8 定位略模糊、家庭人口多的客户更偏好 LS9；L6 目标客户在二线城市较少；设计对年轻群体吸引力不足；LS6 客户群体较广且存在被 L6 颜值吸引后转选 LS6 的溢出。",
    "evidence_ids": [
      "EV-0018",
      "EV-0027",
      "EV-0028"
    ],
    "evidence_count": 3,
    "store_count": 2,
    "stores": [
      "贵阳·万象汇",
      "贵阳·贵阳万象汇"
    ],
    "severity": "medium",
    "severity_rationale": "跨 3 店复现，涉及定位与人群匹配，可能影响线索投放效率，但当前无直接拒购证据。",
    "business_signal": "other",
    "status": "confirmed",
    "first_seen_date": "2026-09-12",
    "last_seen_date": "2026-09-12",
    "review": {
      "reviewed_by": "opencode-agent",
      "reviewed_at": "2026-09-12",
      "decision": "confirmed",
      "notes": "4 条证据跨 3 店；LS8/LS9 与 L6 定位问题合并为『定位与人群区隔』。"
    },
    "pattern_ids": [
      "PAT-0006"
    ],
    "created_at": "2026-09-12"
  },
  {
    "issue_id": "ISS-0007",
    "title": "店端线索与自然客流不足",
    "category": "sales_service",
    "series": [
      "LS6",
      "L6"
    ],
    "affected_function": "门店线索 / 自然客流",
    "description": "门店缺乏线索、客流严重受限，仅靠邀约；部分门店位置特殊、周边无广告位，自然客流多为修车人群；也有门店反馈流量较以往明显减少、以邀约小订客户为主。",
    "evidence_ids": [
      "EV-0008",
      "EV-0011",
      "EV-0013"
    ],
    "evidence_count": 3,
    "store_count": 3,
    "stores": [
      "重庆·南岸交付中心",
      "重庆·渝北交付中心",
      "重庆·重庆礼嘉天街e"
    ],
    "severity": "high",
    "severity_rationale": "跨 3 店一致反馈客流/线索约束，直接影响到店与转化基础。",
    "business_signal": "operational",
    "status": "confirmed",
    "first_seen_date": "2026-09-12",
    "last_seen_date": "2026-09-12",
    "review": {
      "reviewed_by": "opencode-agent",
      "reviewed_at": "2026-09-12",
      "decision": "confirmed",
      "notes": "3 条证据同一日、3 家重庆门店；与品牌认知约束合并入同一 pattern。"
    },
    "pattern_ids": [
      "PAT-0001"
    ],
    "created_at": "2026-09-12"
  },
  {
    "issue_id": "ISS-0008",
    "title": "后轮转向/长轴距为重庆购车动因",
    "category": "driving_dynamics",
    "series": [
      "LS6",
      "L6"
    ],
    "affected_function": "后轮转向 / 市区适用性",
    "description": "长轴距车辆的后轮转向在重庆市区适用度很高，多名用户将其列为购车原因之一。",
    "evidence_ids": [
      "EV-0009"
    ],
    "evidence_count": 1,
    "store_count": 1,
    "stores": [
      "重庆·南岸交付中心"
    ],
    "severity": "low",
    "severity_rationale": "单店单条，属正向动因，不构成问题。",
    "business_signal": "positive_signal",
    "status": "confirmed",
    "first_seen_date": "2026-09-12",
    "last_seen_date": "2026-09-12",
    "review": {
      "reviewed_by": "opencode-agent",
      "reviewed_at": "2026-09-12",
      "decision": "confirmed",
      "notes": "单条正向证据，可与其他优势项合并为优势 pattern。"
    },
    "pattern_ids": [
      "PAT-0007"
    ],
    "created_at": "2026-09-12"
  },
  {
    "issue_id": "ISS-0009",
    "title": "大满配定价与配置加分获正向反馈",
    "category": "configuration",
    "series": [
      "LS6",
      "L6"
    ],
    "affected_function": "定价策略 / 配置价值感",
    "description": "LS6「20 万起大满配」最令用户满意、普遍期待上市价；四门电吸、B&O 音响提升印象；knock knock 功能关注度较高。",
    "evidence_ids": [
      "EV-0017",
      "EV-0021",
      "EV-0023"
    ],
    "evidence_count": 3,
    "store_count": 3,
    "stores": [
      "贵阳·智己汽车贵阳悦然时光体验中心",
      "贵阳·贵阳万象汇",
      "重庆·重庆金菱车世界车城店"
    ],
    "severity": "low",
    "severity_rationale": "跨 3 店正向反馈，属可强化卖点而非问题。",
    "business_signal": "positive_signal",
    "status": "confirmed",
    "first_seen_date": "2026-09-12",
    "last_seen_date": "2026-09-12",
    "review": {
      "reviewed_by": "opencode-agent",
      "reviewed_at": "2026-09-12",
      "decision": "confirmed",
      "notes": "3 条正向证据跨 3 店；合并定价与配置加分。"
    },
    "pattern_ids": [
      "PAT-0007"
    ],
    "created_at": "2026-09-12"
  },
  {
    "issue_id": "ISS-0010",
    "title": "试驾转化积极",
    "category": "sales_service",
    "series": [
      "LS6",
      "L6"
    ],
    "affected_function": "试驾 / 小订转化",
    "description": "LS6 试驾排满、其他车型试驾较少；当日完成试驾的用户基本都提交了小订，试驾到小订转化顺畅。",
    "evidence_ids": [
      "EV-0019",
      "EV-0025"
    ],
    "evidence_count": 2,
    "store_count": 2,
    "stores": [
      "贵阳·贵阳万象汇",
      "重庆·重庆金菱车世界车城店"
    ],
    "severity": "low",
    "severity_rationale": "跨 2 店正向证据，属优势项。",
    "business_signal": "positive_signal",
    "status": "confirmed",
    "first_seen_date": "2026-09-12",
    "last_seen_date": "2026-09-12",
    "review": {
      "reviewed_by": "opencode-agent",
      "reviewed_at": "2026-09-12",
      "decision": "confirmed",
      "notes": "2 条证据跨 2 店 1 天。"
    },
    "pattern_ids": [
      "PAT-0007"
    ],
    "created_at": "2026-09-12"
  },
  {
    "issue_id": "ISS-0013",
    "title": "门店人气与新车效应正向",
    "category": "sales_service",
    "series": [
      "LS6",
      "L6"
    ],
    "affected_function": "门店人气 / 新车效应",
    "description": "快闪门店位于商场中庭、人流量极大；新车效应仍在，部分到店人员了解新发布产品，大量人员知晓无方向盘概念车。",
    "evidence_ids": [
      "EV-0029",
      "EV-0030"
    ],
    "evidence_count": 2,
    "store_count": 1,
    "stores": [
      "遵义·吾悦广场快闪"
    ],
    "severity": "low",
    "severity_rationale": "单店正向证据，属可复用的人气/新车效应经验。",
    "business_signal": "positive_signal",
    "status": "confirmed",
    "first_seen_date": "2026-09-12",
    "last_seen_date": "2026-09-12",
    "review": {
      "reviewed_by": "opencode-agent",
      "reviewed_at": "2026-09-12",
      "decision": "confirmed",
      "notes": "2 条证据同一店同一天；并入优势 pattern。"
    },
    "pattern_ids": [
      "PAT-0007"
    ],
    "created_at": "2026-09-12"
  }
]
