[
  {
    "issue_id": "ISS-0001",
    "title": "竞品车机对话比 LS6 更流畅",
    "category": "smart_cockpit",
    "series": ["LS6"],
    "affected_function": "车机语音对话",
    "description": "用户对比后认为竞品车机对话比 LS6 更流畅，智能座舱交互成为用户横向对比时可感知的对标点。",
    "evidence_ids": ["EV-0001"],
    "evidence_count": 1,
    "store_count": 1,
    "stores": ["重庆万州·万州万达广场快慢闪"],
    "severity": "low",
    "severity_rationale": "单店单条用户对比表述，未直接表述拒购或竞品分流。",
    "business_signal": "competitive_gap",
    "status": "confirmed",
    "first_seen_date": "2026-09-20",
    "last_seen_date": "2026-09-20",
    "review": {
      "reviewed_by": "opencode-agent",
      "reviewed_at": "2026-09-20",
      "decision": "confirmed",
      "notes": "单条用户原话；与既有竞品智能对标模式语义一致，作为当日证据。"
    },
    "pattern_ids": ["PAT-0001"],
    "created_at": "2026-09-20"
  },
  {
    "issue_id": "ISS-0002",
    "title": "主副驾屏设计感知不适",
    "category": "interior",
    "series": ["LS6"],
    "affected_function": "主副驾屏幕设计",
    "description": "用户认为智己主副驾屏幕看起来「怪」，屏幕布局与视觉感受未获得用户直觉认同。",
    "evidence_ids": ["EV-0002"],
    "evidence_count": 1,
    "store_count": 1,
    "stores": ["重庆万州·万州万达广场快慢闪"],
    "severity": "low",
    "severity_rationale": "单店单条用户观感表述，属进店第一印象层面的轻微吐槽。",
    "business_signal": "complaint",
    "status": "confirmed",
    "first_seen_date": "2026-09-20",
    "last_seen_date": "2026-09-20",
    "review": {
      "reviewed_by": "opencode-agent",
      "reviewed_at": "2026-09-20",
      "decision": "confirmed",
      "notes": "单条用户原话；与内饰细节设计感知模式语义一致。"
    },
    "pattern_ids": ["PAT-0002"],
    "created_at": "2026-09-20"
  },
  {
    "issue_id": "ISS-0003",
    "title": "内饰质感与豪华感对标不足",
    "category": "interior",
    "series": ["LS6"],
    "affected_function": "内饰材质与豪华感",
    "description": "现款 LS6 内饰被用户吐槽像 2001 年的感觉，扶手下方塑料件建议改软包；专家对比指出阿维塔更具豪华感与环抱感；同时认可 LS6 已减少塑料感。",
    "evidence_ids": ["EV-0003", "EV-0004", "EV-0005", "EV-0006"],
    "evidence_count": 4,
    "store_count": 1,
    "stores": ["重庆万州·万州万达广场快慢闪"],
    "severity": "medium",
    "severity_rationale": "同店多条反馈集中指向内饰质感与豪华感，含年代感吐槽与具体软包诉求，可能影响价值感知。",
    "business_signal": "competitive_gap",
    "status": "confirmed",
    "first_seen_date": "2026-09-20",
    "last_seen_date": "2026-09-20",
    "review": {
      "reviewed_by": "opencode-agent",
      "reviewed_at": "2026-09-20",
      "decision": "confirmed",
      "notes": "4 条证据同属内饰材质与豪华感维度，合并为一个 issue；含正面（塑料感减少）与对标（阿维塔）两条不同方向。"
    },
    "pattern_ids": ["PAT-0003"],
    "created_at": "2026-09-20"
  },
  {
    "issue_id": "ISS-0004",
    "title": "配置与设计叙事受竞品带动、解释成本高",
    "category": "other",
    "series": ["LS6"],
    "affected_function": "座舱配置 / 门把手设计叙事",
    "description": "用户对「头等舱」式座舱配置接受度不高，认知受理想等竞品带动；门把手对新国标解释成本高，半隐藏式设计亦受竞品趋势影响。",
    "evidence_ids": ["EV-0007", "EV-0008"],
    "evidence_count": 2,
    "store_count": 1,
    "stores": ["重庆万州·万州万达广场快慢闪"],
    "severity": "medium",
    "severity_rationale": "同店两条专家观察，反映配置与外观叙事被竞品带动、一线解释成本高。",
    "business_signal": "other",
    "status": "confirmed",
    "first_seen_date": "2026-09-20",
    "last_seen_date": "2026-09-20",
    "review": {
      "reviewed_by": "opencode-agent",
      "reviewed_at": "2026-09-20",
      "decision": "confirmed",
      "notes": "2 条证据同属「设计叙事受竞品带动、需高解释成本」维度；「阿联酋头等舱」为原文表述，语义待澄清。"
    },
    "pattern_ids": ["PAT-0004"],
    "created_at": "2026-09-20"
  },
  {
    "issue_id": "ISS-0005",
    "title": "品牌偏小众、工作日自然客流弱",
    "category": "other",
    "series": ["L6", "LS6"],
    "affected_function": "品牌认知 / 门店客流",
    "description": "用户认为 LS6 偏小众；专家观察工作日自然进店客流很少、虹吸效应明显，展台更多承担广告曝光作用。",
    "evidence_ids": ["EV-0009", "EV-0010"],
    "evidence_count": 2,
    "store_count": 1,
    "stores": ["天津·天津龙湖天街智己汽车"],
    "severity": "medium",
    "severity_rationale": "2 条同店反馈指向品牌认知弱与自然客流不足，属下单前置约束。",
    "business_signal": "operational",
    "status": "confirmed",
    "first_seen_date": "2026-09-20",
    "last_seen_date": "2026-09-20",
    "review": {
      "reviewed_by": "opencode-agent",
      "reviewed_at": "2026-09-20",
      "decision": "confirmed",
      "notes": "2 条证据同属天津 1 家门店、1 天；同属品牌认知与客流吸引力维度，合并为一个 issue。"
    },
    "pattern_ids": ["PAT-0005"],
    "created_at": "2026-09-20"
  },
  {
    "issue_id": "ISS-0006",
    "title": "有效线索下发是订单转化关键",
    "category": "sales_service",
    "series": ["L6", "LS6"],
    "affected_function": "线索下发 / 转化",
    "description": "在自然客流不足、展台以曝光为主的情况下，专家认为要形成订单，有效线索下发很重要。",
    "evidence_ids": ["EV-0011"],
    "evidence_count": 1,
    "store_count": 1,
    "stores": ["天津·天津龙湖天街智己汽车"],
    "severity": "medium",
    "severity_rationale": "单店单条运营建议，指向门店转化抓手，非产品抱怨。",
    "business_signal": "feature_request",
    "status": "confirmed",
    "first_seen_date": "2026-09-20",
    "last_seen_date": "2026-09-20",
    "review": {
      "reviewed_by": "opencode-agent",
      "reviewed_at": "2026-09-20",
      "decision": "confirmed",
      "notes": "单条专家建议；归入门店运营与转化动作模式。"
    },
    "pattern_ids": ["PAT-0006"],
    "created_at": "2026-09-20"
  }
]
