[
  {
    "issue_id": "ISS-0001",
    "title": "品牌定位与低线城市用户心智错位",
    "category": "other",
    "series": ["LS6", "L6"],
    "affected_function": "品牌定位 / 用户心智",
    "description": "一线专家观察，当前偏一线城市的品牌定位与三四线城市用户更看重油电转换能力的心智存在错位，可能影响低线城市的产品叙事与用户关注点匹配。",
    "evidence_ids": ["EV-0001"],
    "evidence_count": 1,
    "store_count": 1,
    "stores": ["重庆万州·万州万达快慢闪"],
    "severity": "low",
    "severity_rationale": "单店单条专家观察，未直接表述拒购或竞品分流。",
    "business_signal": "other",
    "status": "confirmed",
    "first_seen_date": "2026-09-19",
    "last_seen_date": "2026-09-19",
    "review": {
      "reviewed_by": "opencode-agent",
      "reviewed_at": "2026-09-19",
      "decision": "confirmed",
      "notes": "单条专家观察，可追溯；作为定位与人群心智的观察项保留。"
    },
    "pattern_ids": ["PAT-0001"],
    "created_at": "2026-09-19"
  },
  {
    "issue_id": "ISS-0002",
    "title": "内饰细节设计与操作感知不符合直觉",
    "category": "interior",
    "series": ["LS6", "L6"],
    "affected_function": "内饰细节 / 操作方式",
    "description": "用户认为副驾屏设计有些奇怪；L6 化妆镜的打开方式比较隐蔽，内饰细节的设计与操作方式存在不符合用户直觉之处。",
    "evidence_ids": ["EV-0002", "EV-0006"],
    "evidence_count": 2,
    "store_count": 2,
    "stores": ["重庆万州·万州万达快慢闪", "天津·天津龙湖天街店"],
    "severity": "low",
    "severity_rationale": "两条跨店反馈均为轻微设计与操作吐槽，未影响购买决策。",
    "business_signal": "complaint",
    "status": "confirmed",
    "first_seen_date": "2026-09-19",
    "last_seen_date": "2026-09-19",
    "review": {
      "reviewed_by": "opencode-agent",
      "reviewed_at": "2026-09-19",
      "decision": "confirmed",
      "notes": "2 条证据跨 2 店；同属内饰细节设计与操作维度，合并为一个 issue。"
    },
    "pattern_ids": ["PAT-0002"],
    "created_at": "2026-09-19"
  },
  {
    "issue_id": "ISS-0003",
    "title": "LS6 前备箱开启不灵敏",
    "category": "storage",
    "series": ["LS6"],
    "affected_function": "前备箱开启",
    "description": "一线反馈 LS6 前备箱开启不够灵敏，影响前部储物使用的顺畅度。",
    "evidence_ids": ["EV-0003"],
    "evidence_count": 1,
    "store_count": 1,
    "stores": ["天津·天津龙湖天街店"],
    "severity": "medium",
    "severity_rationale": "单店明确抱怨，属常见使用场景的功能不畅，但未表述拒购。",
    "business_signal": "complaint",
    "status": "confirmed",
    "first_seen_date": "2026-09-19",
    "last_seen_date": "2026-09-19",
    "review": {
      "reviewed_by": "opencode-agent",
      "reviewed_at": "2026-09-19",
      "decision": "confirmed",
      "notes": "单条证据；与既有前备箱储物模式语义一致，作为当日证据。"
    },
    "pattern_ids": ["PAT-0003"],
    "created_at": "2026-09-19"
  },
  {
    "issue_id": "ISS-0004",
    "title": "LS6 智能语音识别不稳定",
    "category": "smart_cockpit",
    "series": ["LS6"],
    "affected_function": "智能语音",
    "description": "一线反馈 LS6 智能语音识别有时不准确，影响智能座舱的基础体验。",
    "evidence_ids": ["EV-0004"],
    "evidence_count": 1,
    "store_count": 1,
    "stores": ["天津·天津龙湖天街店"],
    "severity": "medium",
    "severity_rationale": "单店明确抱怨，属智能座舱基础功能体验问题。",
    "business_signal": "complaint",
    "status": "confirmed",
    "first_seen_date": "2026-09-19",
    "last_seen_date": "2026-09-19",
    "review": {
      "reviewed_by": "opencode-agent",
      "reviewed_at": "2026-09-19",
      "decision": "confirmed",
      "notes": "单条证据；与既有智能座舱语音模式语义一致。"
    },
    "pattern_ids": ["PAT-0004"],
    "created_at": "2026-09-19"
  },
  {
    "issue_id": "ISS-0005",
    "title": "用户询问 LS6 增程版本换新节奏",
    "category": "other",
    "series": ["LS6"],
    "affected_function": "车型焕新节奏 / 需求等待",
    "description": "用户询问 LS6 增程版本什么时候换新，反映部分需求在等待版本更新后再决策。",
    "evidence_ids": ["EV-0005"],
    "evidence_count": 1,
    "store_count": 1,
    "stores": ["天津·天津龙湖天街店"],
    "severity": "low",
    "severity_rationale": "单店单条用户询问，属需求节奏信号，非明确抱怨或拒购。",
    "business_signal": "other",
    "status": "confirmed",
    "first_seen_date": "2026-09-19",
    "last_seen_date": "2026-09-19",
    "review": {
      "reviewed_by": "opencode-agent",
      "reviewed_at": "2026-09-19",
      "decision": "confirmed",
      "notes": "单条用户询问；归入等待新款模式。"
    },
    "pattern_ids": ["PAT-0005"],
    "created_at": "2026-09-19"
  },
  {
    "issue_id": "ISS-0006",
    "title": "L6 高定版溢价价值感不足",
    "category": "configuration",
    "series": ["L6"],
    "affected_function": "高定版 / 价值感",
    "description": "用户质疑 L6 高定版多出的 2 万元价值感体现在哪里，高定版相对基础版的溢价缺少可感知价值支撑。",
    "evidence_ids": ["EV-0007"],
    "evidence_count": 1,
    "store_count": 1,
    "stores": ["天津·天津龙湖天街店"],
    "severity": "medium",
    "severity_rationale": "单店明确的用户价值质疑，可能影响高定版成交意愿。",
    "business_signal": "complaint",
    "status": "confirmed",
    "first_seen_date": "2026-09-19",
    "last_seen_date": "2026-09-19",
    "review": {
      "reviewed_by": "opencode-agent",
      "reviewed_at": "2026-09-19",
      "decision": "confirmed",
      "notes": "单条用户原话；作为配置价值感知问题的当日证据。"
    },
    "pattern_ids": ["PAT-0006"],
    "created_at": "2026-09-19"
  },
  {
    "issue_id": "ISS-0007",
    "title": "L6 高定版元素做工粗糙、棱角刮手",
    "category": "quality_reliability",
    "series": ["L6"],
    "affected_function": "高定版 / 做工",
    "description": "一线反馈 L6 高定版元素做工略显粗糙，棱角有刮手感，影响做工质感评价并存在磕碰风险。",
    "evidence_ids": ["EV-0008"],
    "evidence_count": 1,
    "store_count": 1,
    "stores": ["天津·天津龙湖天街店"],
    "severity": "medium",
    "severity_rationale": "单店明确做工抱怨，涉及使用手感与潜在磕碰风险。",
    "business_signal": "complaint",
    "status": "confirmed",
    "first_seen_date": "2026-09-19",
    "last_seen_date": "2026-09-19",
    "review": {
      "reviewed_by": "opencode-agent",
      "reviewed_at": "2026-09-19",
      "decision": "confirmed",
      "notes": "单条证据；与既有内饰锐角风险模式语义一致。"
    },
    "pattern_ids": ["PAT-0007"],
    "created_at": "2026-09-19"
  },
  {
    "issue_id": "ISS-0008",
    "title": "竞品在情绪价值与个性化上的差距",
    "category": "other",
    "series": ["L6"],
    "affected_function": "产品价值感 / 差异化",
    "description": "关于 L6 的竞品，用户更看重情绪价值、更多个性化与差异化，形成可感知的价值对标维度。",
    "evidence_ids": ["EV-0009"],
    "evidence_count": 1,
    "store_count": 1,
    "stores": ["天津·天津龙湖天街店"],
    "severity": "low",
    "severity_rationale": "单店单条用户表述，属价值取向信号，未明确指向具体竞品或拒购。",
    "business_signal": "competitive_gap",
    "status": "confirmed",
    "first_seen_date": "2026-09-19",
    "last_seen_date": "2026-09-19",
    "review": {
      "reviewed_by": "opencode-agent",
      "reviewed_at": "2026-09-19",
      "decision": "confirmed",
      "notes": "单条用户表述；登记为竞品情绪价值与个性化差距的新语义。"
    },
    "pattern_ids": ["PAT-0008"],
    "created_at": "2026-09-19"
  }
]
